{
  "$schema": "https://json-schema.org/draft/2020-12/schema",
  "$id": "https://github.com/luduranoficiall/ciencia-da-computacao/schemas/curriculum.schema.json",
  "title": "Curriculum graph",
  "type": "object",
  "additionalProperties": false,
  "required": ["version", "nodes", "edges"],
  "properties": {
    "version": {
      "type": "integer",
      "minimum": 1
    },
    "description": {
      "type": "string"
    },
    "nodes": {
      "type": "array",
      "minItems": 1,
      "items": {
        "type": "object",
        "additionalProperties": false,
        "required": ["id", "title", "stage", "tags"],
        "properties": {
          "id": {
            "type": "string",
            "minLength": 1,
            "pattern": "^[a-z][a-z0-9_]*$"
          },
          "title": {
            "type": "string",
            "minLength": 1
          },
          "stage": {
            "type": "integer",
            "minimum": 1,
            "maximum": 99
          },
          "tags": {
            "type": "array",
            "minItems": 1,
            "items": {
              "type": "string",
              "minLength": 1
            }
          }
        }
      }
    },
    "edges": {
      "type": "array",
      "items": {
        "type": "array",
        "minItems": 2,
        "maxItems": 2,
        "items": {
          "type": "string",
          "minLength": 1
        }
      }
    }
  }
}
