{
  "version": 2,
  "description": "Grafo dirigido aciclico (DAG) alinhado as tabelas de pre-requisitos do README principal. v2: arestas extras para BD, prog. logica, met. pesquisa e ordem PL->Prog II. IDs estaveis para scripts e futuras ferramentas.",
  "nodes": [
    {"id": "discreta", "title": "Matematica discreta", "stage": 1, "tags": ["math", "logic"]},
    {"id": "circuitos", "title": "Circuitos digitais", "stage": 1, "tags": ["systems"]},
    {"id": "ling_prog", "title": "Linguagens de programacao (conceitos)", "stage": 1, "tags": ["pl"]},
    {"id": "prog1", "title": "Programacao I", "stage": 1, "tags": ["code"]},
    {"id": "geo", "title": "Geometria analitica", "stage": 1, "tags": ["math"]},
    {"id": "calc1", "title": "Calculo I", "stage": 2, "tags": ["math"]},
    {"id": "alg_lin1", "title": "Algebra linear I", "stage": 2, "tags": ["math"]},
    {"id": "ed", "title": "Estruturas de dados", "stage": 2, "tags": ["code", "algorithms"]},
    {"id": "prog2", "title": "Programacao II", "stage": 2, "tags": ["code"]},
    {"id": "oo", "title": "Orientacao a objetos / lab OO", "stage": 2, "tags": ["code"]},
    {"id": "grafos", "title": "Algoritmos em grafos", "stage": 3, "tags": ["algorithms"]},
    {"id": "arq1", "title": "Arquitetura de computadores I", "stage": 3, "tags": ["systems"]},
    {"id": "prob_est", "title": "Probabilidade e estatistica", "stage": 3, "tags": ["math", "ml"]},
    {"id": "calc2", "title": "Calculo II", "stage": 3, "tags": ["math"]},
    {"id": "funcional", "title": "Programacao funcional", "stage": 3, "tags": ["code", "pl"]},
    {"id": "analise_alg", "title": "Analise de algoritmos", "stage": 4, "tags": ["algorithms"]},
    {"id": "met_num", "title": "Metodos numericos", "stage": 4, "tags": ["math", "code"]},
    {"id": "bd", "title": "Banco de dados", "stage": 4, "tags": ["systems"]},
    {"id": "arq2", "title": "Arquitetura de computadores II", "stage": 4, "tags": ["systems"]},
    {"id": "prog_logica", "title": "Programacao logica", "stage": 4, "tags": ["pl"]},
    {"id": "redes", "title": "Redes de computadores", "stage": 5, "tags": ["systems"]},
    {"id": "eng_sw", "title": "Engenharia de software", "stage": 5, "tags": ["engineering"]},
    {"id": "so", "title": "Sistemas operacionais", "stage": 5, "tags": ["systems"]},
    {"id": "prog_mat", "title": "Programacao matematica / PO", "stage": 5, "tags": ["math"]},
    {"id": "comp_grafica", "title": "Computacao grafica (fundamentos)", "stage": 5, "tags": ["graphics", "math"]},
    {"id": "automatos", "title": "Linguagens formais e automatos", "stage": 6, "tags": ["theory", "pl"]},
    {"id": "ia", "title": "Inteligencia artificial", "stage": 6, "tags": ["ml", "algorithms"]},
    {"id": "dist", "title": "Sistemas distribuidos", "stage": 6, "tags": ["systems"]},
    {"id": "teo_grafos", "title": "Teoria dos grafos", "stage": 6, "tags": ["math", "theory"]},
    {"id": "calc3", "title": "Calculo III", "stage": 6, "tags": ["math"]},
    {"id": "teo_comp", "title": "Teoria da computacao", "stage": 7, "tags": ["theory"]},
    {"id": "dl", "title": "Deep learning", "stage": 7, "tags": ["ml"]},
    {"id": "compiladores", "title": "Compiladores", "stage": 7, "tags": ["pl", "systems"]},
    {"id": "quantica", "title": "Computacao quantica", "stage": 7, "tags": ["math", "systems"]},
    {"id": "met_pesquisa", "title": "Metodologia da pesquisa", "stage": 7, "tags": ["research"]}
  ],
  "edges": [
    ["discreta", "ed"],
    ["discreta", "automatos"],
    ["discreta", "teo_grafos"],
    ["discreta", "prog_logica"],
    ["circuitos", "arq1"],
    ["prog1", "ed"],
    ["prog1", "prog2"],
    ["prog1", "oo"],
    ["prog1", "bd"],
    ["prog1", "met_num"],
    ["ling_prog", "prog2"],
    ["geo", "calc1"],
    ["geo", "alg_lin1"],
    ["geo", "comp_grafica"],
    ["calc1", "prob_est"],
    ["calc1", "calc2"],
    ["calc1", "met_num"],
    ["calc2", "calc3"],
    ["alg_lin1", "prog_mat"],
    ["ed", "grafos"],
    ["ed", "ia"],
    ["ed", "compiladores"],
    ["grafos", "analise_alg"],
    ["prog2", "funcional"],
    ["prog2", "arq2"],
    ["prog2", "eng_sw"],
    ["eng_sw", "met_pesquisa"],
    ["arq1", "arq2"],
    ["prob_est", "ia"],
    ["teo_grafos", "compiladores"],
    ["calc3", "quantica"],
    ["arq2", "so"],
    ["arq2", "quantica"],
    ["redes", "dist"],
    ["ia", "dl"],
    ["automatos", "teo_comp"]
  ]
}
